{
  "contract_family": "source-session-handoff",
  "contract_version": "v1.0",
  "profile": "oauth2-authorization-code-pkce-s256-v1",
  "purpose": "user-entry-session-handoff",
  "handoff_ref": "handoff-placeholder-001",
  "issuer": "issuer-placeholder-001",
  "receiver_ref": "receiver-placeholder-001",
  "client_ref": "client-placeholder-001",
  "destination_uri": "https://receiver.example/session-handoff/callback",
  "transaction_ref": "transaction-placeholder-001",
  "nonce_ref": "nonce-placeholder-001",
  "requested_record_scope_refs": [
    "record-scope-placeholder-002",
    "record-scope-placeholder-001"
  ],
  "initiated_at": "2026-08-15T00:00:00Z",
  "expires_at": "2026-08-15T00:00:45Z",
  "correlation_ref": "correlation-placeholder-001"
}
